"Prefix","Number","Title","Hours","Description","Unk","Taught"
"AHST","1303","Survey of Western Art History: Ancient to Medieval","3","An introduction to painting, sculpture, and architecture in the West from prehistory through the late Middle Ages and including the achievements of the ancient Egyptian, Greek, Roman, and Medieval cultures. Monuments will be studied within their historical, religious, and social contexts, with particular focus on the role of art in society and on the development of style.","3-0","Y"
"AHST","1304","Survey of Western Art History: Renaissance to Modern","3","An introduction to painting, sculpture, and architecture in the West from the Renaissance to the modern period, including work by such artists as Michelangelo, Rembrandt, the Impressionists, and Picasso. Artists and monuments will be studied within their historical, religious, and social contexts, with particular focus on the role of art in society and on the development of style.","3-0","Y"
"AHST","2331","Understanding Art","3","An investigation into the nature of the visual arts with an emphasis on the issues and ideas that artists explore through their work and how these ideas translate into the artwork. Attention will be given to the interpretation or ""reading"" of the artwork and how it may relate to society.","3-0","Y"
"AHST","2390","Topics in Art History","3","Subjects will vary from semester to semester. May be repeated for credit as topics vary (9 hours maximum). Prerequisite: AHST 1303, AHST 1304, AHST 2331, or ARTS 1301.","3-0","R"
"AHST","2V71","Independent Study in Art History","1-3","Independent study under a faculty member's direction. Signature of instructor on proposed project outline required. May be repeated for credit (9 hours maximum).","[1-3]-0","R"
"AHST","3315","The Art of the Renaissance","3","Studies in the art and architecture of Italy and Northern Europe during the 14th, 15th, and 16th centuries. Special attention is paid to the role of patronage, the developing self-consciousness of the artist, and the importance of new techniques. Prerequisite: AHST 1303, AHST 1304, AHST 2331,  or ARTS 1301.","3-0","T"
"AHST","3316","The Art of the Baroque","3","Studies in the art and architecture of the 17th and 18th centuries in Europe. Emphasis is on the social and religious bases of the baroque styles and on the impact of certain artistic personalities, such as Bernini, Rubens, Velazquez, and Rembrandt. Prerequisite: AHST 1303, AHST 1304, AHST 2331,  or ARTS 1301. ","3-0","T"
"AHST","3317","Pioneers of Modern Art","3","Focus on the work of the Post-Impressionists (Seurat, Gauguin, Van Gogh, and Cézanne) and the Symbolists with special emphasis on the artist's contribution to the discourse of ideas and the crisis of meaning in the late 19th century. Prerequisite: AHST 1303, AHST 1304, AHST 2331,  or ARTS 1301. ","3-0","T"
"AHST","3318","Contemporary Art","3","An issue-oriented class in which a selection of recent developments in art serve to introduce the ideas and aims of postmodernism. Special attention is given to those artists who are concerned with representation and the visual element in social constructs. Prerequisite: AHST 1303, AHST 1304, AHST 2331,  or ARTS 1301. ","3-0","T"
"AHST","3319","Twentieth-Century European Art: Avant-Garde and Aftermath","3","The situation of the European avant-garde before and after its explosive center point of World War I. Special emphasis will be given to the breakthrough of abstraction and modernism's problematic relation to tradition. Prerequisite: AHST 1303, AHST 1304, AHST 2331,  or ARTS 1301. ","3-0","R"
"AHST","3320","Art in Historical Context","3","Studies in the arts and/or architecture of such eras as ancient Greece and Rome or the 18th and 19th centuries. May be repeated for credit as topics vary (9 hours maximum). Prerequisite: AHST 1303, AHST 1304, AHST 2331,  or ARTS 1301. ","3-0","T"
"AHST","3324","History of Photography","3","Photography, from 1825 to the present, as a study of evolving styles, stressing key turning points and contributing factors and focusing on a background of the modern art movement and the psychology and events of the times. Critical analysis of the work of various photographers will be included. Topics may include an emphasis on 19th century, modern, or contemporary photography. Prerequisite: AHST 1303, AHST 1304, AHST 2331,  or ARTS 1301. ","3-0","T"
"AHST","4342","Topics in Art History","3","Subjects will vary from semester to semester. May be repeated for credit as topics vary (6 hours maximum). Prerequisite: AHST 1303, AHST 1304, AHST 2331, or ARTS 1301.","3-0","R"
"AHST","4V71","Independent Study in Art History","1-3","Independent study under a faculty member's direction. Signature of instructor on proposed project outline required. May be repeated for credit (9 hours maximum). Prerequisites: Upper-division standing, and completion of all lower-division requirements in AP and permission of the instructor.","[1-3] -0","R"
"AP","2335","The Creative Process","3","Through discussions, readings, and media presentations of work by contemporary artists, thinkers, makers, and doers, students will begin to discover methods and approaches to the creative experience. This course may be taken only by majors other than Art and Performance and is intended for students without formal studio experience.","3-0","T"
"AP","2V71","Independent Study in Art and Performance","1-3","Independent study under a faculty member's direction. Signature of instructor on proposed project outline required. May be repeated for credit (9 hours maximum). Consent of instructor required.","[1-3] -0","R"
"AP","3300","Elements of Art and Performance","3","An analysis of the elements of space, time, image, text, and gesture as they relate to art making in the various visual and performing arts. These elements will also serve as a starting point from which students will investigate notions of creativity, expression, and aesthetics in a workshop setting. Explorations into what constitutes a work of art, and ways in which a work of art can be perceived and interpreted. This course is a requirement for all AP majors and should be taken prior to completing the first 12 hours of upper-division course work. It is normally offered only during the fall and spring semesters. Prerequisite: ARTS 1301 or AHST 1303 or AHST 1304 or AHST 2331 or DANC 1310 or DRAM 1310 or FILM 2332 or MUSI 1306.","3-0","S"
"AP","3344","Topics in Performance","3","Investigations of the changing structures and methods of performance in theatre, dance, music, film/video, and the visual arts. Students will explore the ""idea of art"" that resides in works which exhibit no singular stylistic attributes and which cut across the traditional boundaries among media. Consideration will be given to the changing role of contemporary criticism that includes analyses outside the formalist tradition: semiotics, Marxism, phenomenology, feminism, and post structuralism. May be repeated for credit as topics vary (9 hours maximum). Prerequisites: Upper-division standing, and completion of all lower-division requirements in AP and permission of the instructor.","3-0","R"
"AP","4370","Interdisciplinary Studies in Art and Performance","3","Subject matter may vary from semester to semester. May be repeated for credit as topics vary (9 hours maximum). Prerequisites: Upper-division standing and completion of all lower-division requirements in AP and permission of the instructor.","3-0","R"
"AP","4399","Senior Honors in Art and Performance","3","Intended for students conducting independent research for honors theses or projects. Signature of instructor on proposed project outline required.","3-0","R"
"AP","4V71","Independent Study in Art and Performance","1-3","Independent study under a faculty member's direction. Signature of instructor on proposed project outline required. May be repeated for credit (9 hours maximum). Prerequisites: Upper-division standing and completion of all lower-division requirements in AP. Consent of instructor required.","[1-3]-0","R"
"ARAB","1311","Beginning Arabic I","3","This course will integrate acquisition of the four language skills (listening, speaking, reading, and writing) with study of Arab culture and civilization.","3-0","Y"
"ARAB","1312","Beginning Arabic II","3","This course is a continuation of Beginning Arabic I. It will integrate acquisition of the four language skills (listening, speaking, reading and writing) with study of Arab culture and civilization.","3-0","Y"
"ARAB","2311","Intermediate Arabic I","3","This course is a continuation of Beginning Arabic. It will include review and application of skills in listening comprehension, speaking, reading, and writing. The course emphasizes conversation, vocabulary acquisition, reading, composition, and culture.","3-0","Y"
"ARAB","2312","Intermediate Arabic II","3","This course is a continuation of Intermediate Arabic I. It will include review and application of skills in listening comprehension, speaking, reading, and writing. The course focuses on conversation, vocabulary acquisition, reading, and composition.  A major course component will be an emphasis on Arabic culture.","3-0","Y"
"ARTS","1301","Exploration of the Arts","3","This course introduces students to the physical and intellectual demands required of the author, the performer, and the visual artist. This introduction includes, but is not limited to, the student's production of a creative project as well as written assessments of art and performance.","3-0","Y"
"ARTS","1311","2D Design Foundations","3","This course provides a foundation for most 3000-level art courses. The course will introduce the problem of working with color and design, emphasizing either traditional studio or digital processes. Lectures and discussions will relate to both the history of visual art and current issues in contemporary art and design.","0-3","Y"
"ARTS","1312","3D Design Foundations","3","This course provides a foundation for courses in sculpture and installation. Emphasis will be placed on working with the materials of sculpture. Concepts that are relevant to three-dimensional design, such as space, mass, and texture, will be presented in a context that relates to the history of sculpture as well as current issues in contemporary art and design.","0-3","Y"
"ARTS","1316","Drawing Foundations","3","This course provides a foundation for drawing and printmaking classes. Emphasis will be placed on the process of charcoal drawing in relation to design concerns such as light, space, form and composition. The importance of drawing as a method both to describe reality and to conceptualize ideas will be stressed.","0-3","Y"
"ARTS","2311","Topics in Visual Art","3","An introduction to specialized topics in the visual arts.  May include historical or cultural elements of visual arts, a genre or artist, or digital aspects of visual art.   May be repeated for credit as topics vary (9 hours maximum).","0-3","R"
"ARTS","2316","Painting Foundations","3","This course provides a foundation for painting classes. Emphasis will be placed on color theory and design as they relate to the process of painting. Lectures and discussions will address both the history of painting and current issues in contemporary art. This course will cover an introduction to the materials of painting, color mixing, and the preparation of painting surfaces.","0-3","Y"
"ARTS","2350","Digital Photography and Design","3","Introduces students to digital photographic processes, including camera operation, image capture, lighting techniques, and digital workflow. Lectures and discussions will relate to both the history of visual art and current issues in contemporary art, photography, and design.","0-3","Y"
"ARTS","2380","2D Design Foundations","3","This course provides a foundation for most 3000-level art courses. The course will introduce the problem of working with color and design, emphasizing either traditional studio or digital processes. Lectures and discussions will relate to both the history of visual art and current issues in contemporary art and design.","0-3","Y"
"ARTS","2381","3D Design Foundations","3","This course provides a foundation for courses in sculpture and installation. Emphasis will be placed on working with the materials of sculpture. Concepts that are relevant to three-dimensional design, such as space, mass, and texture, will be presented in a context that relates to the history of sculpture as well as current issues in contemporary art and design.","0-3","Y"
"ARTS","2V71","Independent Study in Visual Arts","1-3","Independent study under a faculty member's direction. Signature of instructor on proposed project outline required. May be repeated for credit (9 hours maximum).","[1-3]-0","R"
"ARTS","3311","Theory and Practice of Visual Arts","3","This studio art course provides a context for the creation, discussion and critique of visual art. The course aims to fuse engagement in artistic production with reflection on theoretical and socio-cultural issues relevant to contemporary art practices. Prerequisite: ARTS 1316, ARTS 2316, ARTS 2350, ARTS 2380, or ARTS 2381.","0-3","T"
"ARTS","3340","Topics in Studio Art","3","A study of fundamental principles and basic techniques of different media in the visual arts. Sections may be devoted exclusively to sculpture, photography, computer imaging, or painting. May be repeated for credit as topics vary (9 hours maximum). Prerequisite: ARTS 1316, ARTS 2316, ARTS 2350, ARTS 2380, or ARTS 2381.","0-3","T"
"ARTS","3363","Design","3","Explores concepts and techniques in design including color theory, composition, and 2D- and 3D- design. May be repeated for credit as topics vary (6 hours maximum). Prerequisite: ARTS 1316, ARTS 2316, ARTS 2350, ARTS 2380, or ARTS 2381.","0-3","T"
"ARTS","3366","Drawing Concepts","3","An investigation of the approaches to working with media and imagery by looking at traditional and contemporary works.  Student will build skills and technical facility in a variety of media while addressing the concepts behing and meaning of various subjects and approaches to the art of drawing.. Prerequisite: ARTS 1316, ARTS 2380, or permission of instructor.","0-3","Y"
"ARTS","3367","Figure Drawing","3","An introductory class for students who have had some basic drawing experience. The course will cover an introduction to the many diverse representations and applications of the human figure through art. Topics include linear dynamics, various contour line applications, rendering, shading and compositional etiquette using a variety of materials and techniques. Prerequisites: ARTS 1316, ARTS 2380, or permission of instructor.","0-3","Y"
"ARTS","3368","Mixed Media","3","An investigation of the interaction and combination of several traditional visual media using techniques derived from 2D and 3D-dimensional studio arts. May be repeated for credit (6 hours maximum). Prerequisite: ARTS 1316, ARTS 2316, ARTS 2350, ARTS 2380, or ARTS 2381.","0-3","Y"
"ARTS","3369","Intermediate Painting","3","Explores traditional and nontraditional concepts and techniques of painting and the development of style. Topics may include color theory, two-dimensional design, and the nature of representation. May be repeated for credit (6 hours maximum). Prerequisite: ARTS 2316 or permission of instructor.","0-3","S"
"ARTS","3371","Black and White Photography","3","Investigation of the photographic process and an examination of the various levels on which meaning is constructed, including selection of subject matter, concern for aesthetics, and socio-cultural context. Instruction in camera techniques will emphasize 35mm photography. Darkroom processes may include traditional or experimental photographic printing methods. May be repeated for credit (6 hours maximum). Prerequisite: ARTS 1316, ARTS 2350, ARTS 2380, or permission of instructor.","0-3","Y"
"ARTS","3372","Color Photography","3","Investigation of the color photographic process from conceptual, aesthetic, and technical perspectives. Instruction in camera techniques will emphasize digital processes. May be repeated for credit (6 hours maximum). Prerequisite: ARTS 1316, ARTS 2350, ARTS 2380, or permission of instructor. May be repeated for credit (6 hours maximum).","0-3","Y"
"ARTS","3373","Printmaking","3","Explores traditional and nontraditional techniques of printmaking through the various topics of screen printing, etching, woodcut, collagraph, or monoprint. May be repeated for credit (6 hours maximum). Prerequisite: ARTS 1316, ARTS 2316, ARTS 2380, or permission of instructor.","0-3","T"
"ARTS","3375","Sculpture","3","Explores the traditional and nontraditional techniques of three-dimensional work in wood, clay, metal, plastics, fiber, stone. May be repeated for credit as topics vary (6 hours maximum). Prerequisite: ARTS 1316, ARTS 2316, ARTS 2380, ARTS 2381, or permission of instructor.","0-3","Y"
"ARTS","3376","Time-Based Art","3","Exploration of the conceptual demands inherent in the creation of time-based visual art. Topics may include computer animation, video processes, interactive visual arts, and the potential of narrative models. May be repeated for credit as topics vary (6 hours maximum). Prerequisite: ARTS 1316, ARTS 2316, ARTS 2350, ARTS 2380, or ARTS 2381.","0-3","T"
"ARTS","3377","Digital Photography","3","Explores digital photographic processes, with an emphasis on contemporary issues in art and technology. Course includes instruction in camera operation, lighting, image editing software, and output to web and print. May be repeated for credit (6 hours maximum). Prerequisite: ARTS 2350, ATEC 2382, or permission of instructor.","0-3","T"
"ARTS","3379","Photography and New Media","3","Emphasizes the relationship between still image capture and applications in new media contexts, such as networked environments and moving or animated images.  May be repeated for credit (6 hours maximum). Prerequisite: ARTS 1316, ARTS 2350, ARTS 2380, or permission of instructor.","0-3","Y"
"ARTS","4308","Image/Text","3","An exploration of the visual possibilities inherent in the art of the text. Topics may include an investigation of techniques derived from bookmaking, printmaking, photography, computer imaging, or related media that foster the transformation and combination of words and images. The problem of creating text for presentation in a visual environment will be examined. May be repeated for credit as topics vary (6 hours maximum). Prerequisite: A 3000-level studio art course in an appropriate medium or permission of the instructor.","0-3","T"
"ARTS","4368","Advanced Visual Arts","3","May focus on advanced explorations in a specific medium, such as printing, photography, drawing, sculpture, or video. An emphasis may be placed on particular themes, such as narrative or collaboration, or genres, such as landscape or portraiture, or advanced technical processes. May be repeated for credit as topics vary (6 hours maximum). Prerequisite: A 3000-level course in an appropriate medium or permission of instructor).","0-3","T"
"ARTS","4372","Advanced Photography","3","Explores advanced concepts relating to contemporary artistic and photographic practice, with special emphasis placed on portfolio development. Instruction may include digital or film-based photography (35mm, medium- or large-format photography. May be repeated for credit as topics vary (6 hours maximum). Prerequisite:  A 3000-level studio art course in an appropriate medium or permission of the instructor. ","3-0","T"
"ARTS","4V71","Independent Study in Visual Arts","1-3","Independent study under a faculty member's direction. Signature of instructor on proposed project outline required. May be repeated for credit (9 hours maximum). Prerequisite: Upper-division standing and completion of all lower-division requirements in AP and permission of the instructor required.","[1-3]-0","R"
"ATEC","2320","Introductory Topics in Arts and Technology","3","Introduces students to the field of arts and technology. Sections may be devoted exclusively to a single aspect of the field or to a combination of related aspects.","3-0","S"
"ATEC","2321","Writing and Research for New Media","3","This writing-intensive course focuses on writing for new and emergent media environments. The course will introduce digital and electronically augmented information-gathering techniques for use in emerging media and communications.","3-0","Y"
"ATEC","2322","Introduction to Electronic and Digital Communications","3","The course will examine the history of electronic communications with a critical view of their effects on society. The focus will be on the role of the Internet in contemporary life, the commodification of news and information, and will introduce electronic and digital research methods for emerging media and communications.","3-0","Y"
"ATEC","2331","Storyboard and Pre-production","3","Students learn pre-visualization techniques for planning out time-based media projects (film, video, animation, interactive, etc.). Students are given a survey of visual storytelling techniques, such as framing, composition, camera movements, and editing techniques.  Students gain an understanding of narrative story structure and plot construction, as well as learn how to communicate their ideas clearly through the use of storyboards and concept arts. ","3-0","S"
"ATEC","2382","Computer Imaging","3","Introduction to digital image-making and manipulation using contemporary software applications. Graphic and photographic methods are presented and applied to art and design problems. Computer images are prepared for multiple delivery environments, including the Internet, games, animation, and print.","0-3","S"
"ATEC","2383","2D Traditional Animation","3","Students learn techniques for traditional hand-drawn animation and fundamental principles of animation that are universally applicable to 2D, 3D, and web based animation. ","3-0","S"
"ATEC","2384","Basic Design Principles and Practices","3","Foundational overview of design principles and practices common to all design professions, including general rules, laws, and guidelines of commercial design. Students will be introduced to the language of design, sources and resources of design practice, and design specializations and their integration with various relevant technical disciplines.","0-3","S"
"ATEC","2385","Sound Design","3","Introduction to sound design whose main goal is to show and explain the role of sound in single or multiple aspects of the field, including multimedia productions, animation, video games, movies, and live performances.","0-3","S"
"ATEC","3317","3D Modeling and Texturing I","3","An introduction to 3D computer modeling and texturing.  Students will learn how to model hard surface objects with emphasis on creating clean geometric meshes.  Basic texturing fundamentals and techniques will be covered, including UV editing, texture map creations, and application and shader types. Prerequisite: ATEC 2382 .","0-3","S"
"ATEC","3318","Concept Development","3","The creation and development of game and animation concepts through various writing and creation techniques. This class is writing intensive and includes basic design drawing skills lessons.","0-3","S"
"ATEC","3319","Voice Over","3","This course explores the psychological implications as well as the artistic, cultural and social dimensions of the use of voice in films, games, and for various other applications. Students will record, edit, process and diffuse recorded voices as well as learn how to select a voice, write for auditory presentations and direct recording sessions. May be repeated for credit as topics vary (6 hours maximum)  Prerequisite: ATEC 2385.","0-3","S"
"ATEC","3320","Introduction to Writing and Editing for the World Wide Web","3","Introduction to web content writing and editing and the theory and practice of writing online, interactive multi-media text. Emphasis will be placed on editing for the web, fact-checking, and style. The course will emphasize process writing and editorial practices. Prerequisite: RHET 1302.","3-0","S"
"ATEC","3325","Introduction to Computer Mediated Communication","3","An introduction and exploration of the impact of computer technology's influence on human communications. Emphasis will be placed on survey and study of emerging modalities of computer mediated communication activities. Additional analysis of theoretical perspectives involving linguistics and cultural studies among other approaches. Prerequisite: RHET 1302.","3-0","S"
"ATEC","3326","Emergent Media and Mass Communications","3","The course will introduce emerging practices in new media. It will blend theoretical studies and project-intensive practice in leading-edge applications of digital media, interactive media, and Internet communications. Prerequisite: ATEC 2321 or ATEC 2322 or permission of instructor.","3-0","Y"
"ATEC","3327","Lighting and Composition I","3","An introduction to the process of lighting, rendering and compositing computer generated images.  Students will learn to create custom lighting setups and how lighting affects mood, time, and viewer perception.  Additional topics include global illumination, final gather, and render layers. Prerequisite: ATEC 3317.","0-3","Y"
"ATEC","3330","Digital Video Production I","3","Introduction to digital video production examining shooting, editing, and nonlinear post-production techniques. Students will work individually and in teams to produce short video projects. A variety of delivery environments may be explored, including web, mobile, and DVD.","0-3","Y"
