"Prefix","Number","Title","Hours","Description","Unk","Taught"
"HUMA","6300","Interdisciplinary Approaches to the Arts and Humanities","3","Introduction to interdisciplinary approaches to the arts and humanities, including concepts of inquiry and interpretation that form the theoretical bases of the graduate programs, seminars, workshops, and studios. Required of all degree candidates for the Master of Arts, Master of Arts in Teaching, and Doctor of Philosophy in Humanities. ","3-0","S"
"HUMA","6320","French Review","3","Intensive grammar review to assist students in moving from intermediate to advanced work with foreign-language texts. Prerequisite: intermediate proficiency (usually equivalent to four semesters of undergraduate courses). The courses do not meet the language requirement or count in degree plans, but they are offered to help students prepare for the textual interpretation and translation undertaken in the language workshops. Graded on a pass/fail basis.","3-0","Y"
"HUMA","6321","Spanish Review","3","Intensive grammar review to assist students in moving from intermediate to advanced work with foreign-language texts. Prerequisite: intermediate proficiency (usually equivalent to four semesters of undergraduate courses). The courses do not meet the language requirement or count in degree plans, but they are offered to help students prepare for the textual interpretation and translation undertaken in the language workshops. Graded on a pass/fail basis.","3-0","Y"
"HUMA","6323","German Review","3","Intensive grammar review to assist students in moving from intermediate to advanced work with foreign-language texts. Prerequisite: intermediate proficiency (usually equivalent to four semesters of undergraduate courses). The courses do not meet the language requirement or count in degree plans, but they are offered to help students prepare for the textual interpretation and translation undertaken in the language workshops. Graded on a pass/fail basis.","3-0","Y"
"HUMA","6330","French Workshop","3","Intensive grammar review to assist students in moving from intermediate to advanced work with foreign-language texts. Prerequisite: intermediate proficiency (usually equivalent to four semesters of undergraduate courses). The courses do not meet the language requirement or count in degree plans, but they are offered to help students prepare for the textual interpretation and translation undertaken in the language workshops. Graded on a pass/fail basis.","3-0","Y"
"HUMA","6331","Spanish Workshop","3","Intensive grammar review to assist students in moving from intermediate to advanced work with foreign-language texts. Prerequisite: intermediate proficiency (usually equivalent to four semesters of undergraduate courses). The courses do not meet the language requirement or count in degree plans, but they are offered to help students prepare for the textual interpretation and translation undertaken in the language workshops. Graded on a pass/fail basis.","3-0","Y"
"HUMA","6333","German Workshop","3","Intensive grammar review to assist students in moving from intermediate to advanced work with foreign-language texts. Prerequisite: intermediate proficiency (usually equivalent to four semesters of undergraduate courses). The courses do not meet the language requirement or count in degree plans, but they are offered to help students prepare for the textual interpretation and translation undertaken in the language workshops. Graded on a pass/fail basis.","3-0","Y"
"HUMA","6390","Topics in Arts and Humanities","3","Studies of topics that incorporate multiple disciplinary materials and perspectives. (May be repeated for credit as topics vary to a maximum of 9 credit hours.)","3-0","R"
"HUMA","6393","Independent Readings in Arts and Humanities","3","(May be repeated for credit.)","3-0","R"
"HUMA","6395","Independent Research in Arts and Humanities","3","(May be repeated for credit.)","3-0","R"
"HUMA","6V81","Special Topics in Arts and Humanities","1-9","If taken as an independent studies course may count toward minimum course requirements for the M.A. and Ph.D. degree. (May be repeated for credit to a maximum of 9 hours.)","[1-9]-0","R"
"HUMA","7390","Adv. Topics in Arts and Humanities","3","Advanced studies of topics that incorporate multiple disciplinary materials and perspectives.  (May be repeated for credit to a maximum of 9 hours.)","3-0","R"
"HUMA","7V81","Adv. Special Topics in Arts and Humanities","1-9","If taken as an independent studies course may count toward minimum course requirements for the Ph.D. degree. (May be repeated for credit to a maximum of 9 hours.)","[1-9]-0","R"
"HUMA","8303","Independent Readings in Arts and Humanities","3","(May be repeated for credit.)","3-0","R"
"HUMA","8305","Independent Research in Arts and Humanities","3","(May be repeated for credit.)","3-0","R"
"HUMA","8V99","Ph.D. Dissertation","1-9","(May be repeated for credit.)","[1-9]-0","R"
"HUSL","6304","Studies in Literary Themes","3","Examinations of specific themes as they appear in various literary works and traditions. Themes considered in courses may include love, heroism, feminism, the anti-hero, or revolution. (May be repeated for credit as topics vary to a maximum of 9 credit hours.)","3-0","T"
"HUSL","6308","Studies in Literary Forms and Genres","3","Studies in various literary genres, either individually or in relation to each other. Among topics considered will be the difficulties of defining genres, the nature of specific genres, their historical and aesthetic development, and their artistic possibilities. Genres for discussion may include tragedy, comedy, the novel, and various forms of poetic expression. (May be repeated for credit as topics vary to a maximum of 9 credit hours.)","3-0","Y"
"HUSL","6309","Literary Movements","3","Studies in the nature of intellectual and artistic movements, with emphasis on how they affect literary expression. Examples of such movements are romanticism, naturalism, modernism, and postmodernism. (May be repeated for credit as topics vary to a maximum of 9 credit hours).","3-0","Y"
"HUSL","6310","Studies in Literary Interpretation","3","Study of the issues involved in the attempt to interpret dramatic, poetic, and fictional texts. Emphasis will be placed on the writing of interpretive essays and on the exploration of how various cultural and intellectual perspectives as well as different theoretical stances affect the reading of a specific text. (May be repeated for credit as topics vary to a maximum of 6 credit hours.)","3-0","T"
"HUSL","6312","Major Authors","3","Study of one or more major literary figures, such as Dante, Chaucer, Milton, Cervantes, Goethe, Austen, Blake, Balzac, Dostoevsky, Tolstoy, Mann, Eliot, Pound, Woolf, Faulkner, Paz or Borges. (May be repeated for credit as subjects vary to a maximum of 9 credit hours.)","3-0","Y"
"HUSL","6313","Shakespeare","3","Study of the dramatic and/or poetic writings of William Shakespeare. (May be repeated for credit as topics vary to a maximum of 6 credit hours.)","3-0","T"
"HUSL","6314","Jane Austen and Her Time","3","Study of the writings of Jane Austen and the ways in which her work engages the political and social issues of her day.","3-0","T"
"HUSL","6315","Literary Theory","3","Consideration of major literary theories, such as new criticism, deconstruction, gender studies, and chaos theory, with emphasis on how these theories influence and modify the interpretation of literary and other artistic texts. (May be repeated for credit as topics vary to a maximum of 6 credit hours.)","3-0","T"
"HUSL","6330","Studies in Literature and the Other Arts","3","An examination of the links between literature and music, the visual arts, film, theater, and/or dance. Topics and approaches will vary but may include, for example, the fantastic in literature and visual arts, structures in literature and music, adaptations of novels into film, and the pastoral in literature and the visual arts. (May be repeated for credit as topics vary to a maximum of 9 credit hours.)","3-0","T"
"HUSL","6340","Literature Before 1800","3","Studies in the literature and culture of selected periods in the Western tradition. May focus on ancient, medieval, or early modern periods. (May be repeated for credit as topics vary to a maximum of 9 hours)","3-0","T"
"HUSL","6345","Early American Literature","3","Study of literary works written in and about America from the early 1500s to 1800. (May be repeated for credit as topics vary to a maximum of 6 credit hours.)","3-0","T"
"HUSL","6350","Literature of the Nineteenth Century","3","Studies in the literature and culture of the nineteenth century. May focus on British, European, American,  Latin American, or Asian contexts. (May be repeated for credit as topics vary to a maximum of 9 hours)","3-0","T"
"HUSL","6355","Literature, Science, and Culture","3","Seminar emphasizing the treatment in literature of scientific concepts (e.g., relativity, evolution) and technological developments (e.g., computers, virtual reality) of particular importance. (May be repeated for credit as topics vary to a maximum of 6 credit hours.)","3-0","T"
"HUSL","6360","Literature of the Twentieth Century","3","Studies in the literature and culture of the twentieth century. May focus on British, European,  American, Latin American, or Asian contexts. (May be repeated for credit as topics vary to a maximum of 9 hours)","3-0","T"
"HUSL","6370","Studies in Literature and Ideas","3","Studies of the relationship between selected literary texts and major ideas in philosophy, science, and politics. The course will examine systems of thoughts as they are incorporated, delineated, and explored in literature. (May be repeated for credit as topics vary to a maximum of 6 credit hours.)","3-0","T"
"HUSL","6372","Literature and Society","3","Seminar studying the values and concerns of various social groups through a study of literary texts, including consideration of the role of literature and the writer in given societies. (May be repeated for credit as topics vary to a maximum of 9 credit hours.)","3-0","T"
"HUSL","6373","Topics in Latin American Literature","3","Studies in the literatures and cultures of Latin America. (May be repeated for credit as topics vary to a maximum of 9 credit hours.)","3-0","T"
"HUSL","6374","Modern Jewish Literature Across Cultures","3","Study of modern Jewish literatures in multiple national contexts and languages, with emphasis on the interaction between modernity and vision of Jewish identities and traditions.","3-0","T"
"HUSL","6375","German Literature and Ideas 1870-1960","3","Study of the range and diversity of German-Austrian literature and thought from the end of the nineteenth century through the 1960s.","3-0","T"
"HUSL","6376","Literature of Weimar Germany","3","Study of literature written during the Weimar Republic (1918-1933) with attention to formative influences on and cultural-political forces shaping the artistic imagination.","3-0","T"
"HUSL","6378","Literature and the Holocaust","3","Seminar considering both major literary works (novels, short stories, and poems) written under the impact of the Holocaust as well as literary theories responding to these texts. Some emphasis placed on films and other works of visual art.","3-0","T"
"HUSL","6380","The Art and Craft of Translation","3","Workshop designed to provide students with a model not only of literary interpretation but also of an interdisciplinary approach through the act of translating that can be applied to a wide range of texts and issues. Emphasis is on the actual translation of literary texts from another language into English. Issues involved in this process will form the basis of the workshop's theoretical component. (May be repeated for credit to a maximum of 9 credit hours.)","3-0","S"
"HUSL","6381","Critical Approaches to Translation","3","The study of the various approaches to the history, theory, and criticism of literary and humanistic translation. Topics may include the translator's working methods, interviews with translators, multiple translations, the changing nature of interpretive approaches, theoretical models of translation, and criteria for the evaluation of translations. (May be repeated for credit as topics vary to a maximum of 6 credit hours.)","3-0","T"
"HUSL","6383","Teaching First-Year Writing","3","Covers both the methods of teaching first-year writing and pedagogical theories of modern composition. Enrollment required for teaching assistants assigned to sections of Rhetoric 1302, but not limited to such students. (May be repeated for credit to a maximum of 6 hours.)","3-0","Y"
"HUSL","6384","Digital and Visual Rhetorics","3","Covers a wide range of topics addressing the study of visual rhetoric as well as rhetoric in digital environments. Course also emphasizes the relationship of digital and visual rhetorics to media ecology/media studies as well as the implications of these rhetorics for composition pedagogy.","3-0","T"
"HUSL","6385","Rhetorical Theory","3","A historical survey of Western rhetorical theory focusing on major figures in rhetoric.","3-0","T"
"HUSL","6386","Special Topics in Rhetoric","3","A seminar in the study of rhetoric. May include one or more topics such as ethos, histories of rhetoric, the rhetoric of technology and science, the Sophists, rhetoric as epistemic, key figures in rhetoric (e.g., Burke, Foucault, Baudrillard, Spivak, etc.). (May be repeated for credit as topics vary to a maximum of 9 credit hours.)","3-0","R"
"HUSL","6388","The Nature of Language","3","An inquiry into the nature, origins, and evolution of language, the relationship of language to thought and to creativity, language as a social tool, and nonverbal patterns of communication. Survey of linguistic theory and method applicable to the study of the phonological, morphological, lexical, semantic, and syntactic levels of language.","3-0","T"
"HUSL","6389","Applied Linguistics","3","Techniques for comparing two or more languages. The study of traditional and modern theories and practices of language learning and teaching.","3-0","T"
"HUSL","6390","Theory and Practice in Literary Studies","3","Group projects integrating the interpretation of literary texts or themes with experiments in creative writing and performance. (May be repeated for credit as topics vary to a maximum of 9 credit hours.)","3-0","T"
"HUSL","6392","Topics in Literary Studies","3","The study of themes, genres, authors, and/or movements in literature. (May be repeated for credit as topics vary to a maximum of 9 credit hours.)","3-0","R"
"HUSL","6393","Independent Readings in Literary Studies","3","(May be repeated for credit.)","3-0","R"
"HUSL","6394","Independent Research in Literary Studies","3","(May be repeated for credit.)","3-0","R"
"HUSL","6395","Special Topics in Literary Studies","3","Independent studies course that may count toward minimum course requirements for the M.A. degree. (May be repeated for credit to a maximum of 9 hours.)","3-0","R"
"HUSL","6396","Spanish Language, Literature, and Culture","3","Studies in the language, various literary movements, or the general cultures of Spanish-speaking peoples in Europe or Latin America. (May be repeated for credit as topics vary to a maximum of 9 credit hours.)","3-0","R"
"HUSL","6398","World Literatures","3","Studies in literatures from specific regions, ethnic groups, and nationalities within and outside the United States. (May be repeated for credit as topics vary to a maximum of 9 credit hours.)","3-0","T"
"HUSL","6399","Studies in Asian Literature","3","Studies in the literature and cultures of Asia. Topics may include Zen/Chan History, Thought, and Poetry; Confucianism; and the I-Ching (Book of Changes). (May be repeated for credit as topics vary to a maximum of 9 credit hours)","3-0","T"
"HUSL","7308","Advanced Studies in Literary Forms and Genres","3","Advanced studies in various literary genres, either individually or in relation to each other. Topics considered may include the difficulties of defining genres, the nature of specific genres, their historical and aesthetic development, and their artistic possibilities. (May be repeated for credit as topics vary to a maximum of 9 credit hours.)","3-0","T"
"HUSL","7309","Advanced Studies in Literary Movements","3","Advanced studies in the nature of intellectual and artistic movements, with emphasis on how they affect literary expression. Examples of such movements are romanticism, naturalism, modernism, and postmodernism. (May be repeated for credit as topics vary to a maximum of 9 credit hours).","3-0","R"
"HUSL","7322","Advanced Translation Workshop","3","An intensive investigation in a workshop environment of the aesthetics of the art and craft of literary translation focusing on the techniques and processes involved in producing English translations of poetic, dramatic, fictional, and essayistic works. Students are expected to produce publishable translations primarily of works by contemporary international writers. Discussions will include the history and theory of literary translation. Permission of the instructor or previous completion of HUSL 6380 required.","3-0","R"
"HUSL","7350","Advanced Studies in Nineteenth Century Literature","3","Advanced studies in the literature and culture of the nineteenth century. May focus on British, European, American, Asian, or Latin American contexts. (May be repeated for credit as topics vary to a maximum of 9 hours)","3-0","T"
"HUSL","7360","Advanced Studies in Twentieth Century Literature","3","Advanced studies in the literature and culture of the twentieth century. May focus on British, European,  American, Asian, or Latin American contexts. (May be repeated for credit as topics vary to a maximum of 9 hours)","3-0","T"
"HUSL","7370","Advanced Studies in Literature and History","3","Studies of selected literary texts and art movements in times of high political tension (American Revolution, Civil War, Weimar Germany, etc.) (May be repeated for credit as topics vary to a maximum of 9 credit hours.)","3-0","R"
"HUSL","7372","Advanced Studies in Literature and Society","3","Advanced studies of the values and concerns of various social groups through the analysis of literary texts, including consideration of the role of literature and the writer in given societies. (May be repeated for credit as topics vary to a maximum of 9 credit hours.)","3-0","R"
"HUSL","7390","Advanced Special Topics in Literary Studies","3","Independent studies course that may count toward minimum course requirements for the Ph.D. degree. (May be repeated for credit to a maximum of 9 hours.)","3-0","R"
"HUSL","7391","Special Topics in Translation Studies","3","The investigation of the field of Translation Studies. Topics may include the anthropological foundation of translation; the study of crossing cultural barriers; translation methodologies as a model for interdisciplinary research; communication as translation; translation and reading; historical aspects of translation; models of cultural differences; critical approaches to the theories of translation from the Greeks to the present; and specific research and translation projects. (May be repeated for credit as topics vary to a maximum of 9 hours.)","3-0","R"
"HUSL","8303","Independent Readings in Literary Studies","3","(May be repeated for credit.)","3-0","R"
"HUSL","8305","Independent Research in Literary Studies","3","(May be repeated for credit.)","3-0","R"
"ISAH","3130","Careers for A&H Majors","1","This course provides students with assistance in exploring careers in the arts and humanities and in making effective career decisions.","1-0","R"
"ISAH","3131","Careers for ATEC Majors","1","This course provides students with assistance in exploring careers in art and technology and in making effective career decisions.","1-0","R"
"ISAH","4350","Internship","3","Students undertake a new learning experience at a supervised work situation related to their academic interests. An internship provides exposure to a professional working environment, application of theory to working realities, and an opportunity to test skills and clarify goals. Course requirements include formal and reflective writing. May be repeated for credit (6 hours maximum).","3-0","R"
"ISAH","4V88","Special Interdisciplinary Topics in the Arts and Humanities","1-6","Subject matter will vary from semester to semester. May be repeated for credit (9 hours maximum).","[1-6]-0","R"
"JAPN","1311","Beginning Japanese I","3"," This course will integrate acquisition of the four language skills (listening, speaking, reading, and writing) with study of Japanese culture and civilization.","3-0","Y"
"JAPN","1312","Beginning Japanese II","3"," This course is a continuation of beginning Japanese I.  It will include review and application of skills in listening comprehension, speaking, reading, and writing.  The course emphasizes conversation, vocabulary acquisition, reading, composition, and culture. Prerequisite: JAPN 1311 or consent of instructor.","3-0","Y"
"JAPN","2311","Intermediate Japanese I","3"," This course is a continuation of beginning Japanese.  It will include review and application of skills in listening comprehension, speaking, reading, and writing.  The course emphasizes conversation, vocabulary acquisition, reading, composition, and culture. Prerequisite: JAPN 1312 or consent of instructor.","3-0","Y"
"JAPN","2312","Intermediate Japanese II","3"," This course is a continuation of Intermediate Japanese II.  It will include review and application of skills in listening comprehension, speaking, reading, and writing.  The course focuses on conversation, vocabulary acquisition, reading, and composition.  A major course component will be an emphasis on Japanese culture.  Prerequisite: JAPN 2311 or consent of instructor.","3-0","Y"
"LANG","1311","Beginning Language Instruction I","3","This course offers beginning instruction in foreign languages not taught on a regular basis. It integrates acquisition of language skills (listening, speaking, reading, and writing) with study of culture and civilization. Languages will vary but may include Italian, Hindi, or Russian. May be repeated for credit as language varies (6 hours maximum).","3-0","R"
"LANG","1312","Beginning Language Instruction II","3","This course is a continuation of LANG 1311 Beginning Language Instruction I. It will include review and application of skills in listening comprehension, speaking, reading, and writing. The course emphasizes conversation, vocabulary acquisition, reading, composition, and culture. Languages will vary but may include Italian, Hindi, or Russian. May be repeated for credit as language varies (6 hours maximum).","3-0","R"
"LANG","2311","Intermediate Language Instruction I","3","This course is a continuation of beginning instruction in foreign languages not taught on a regular basis. The course integrates acquisition of language skills (listening, speaking, reading, and writing) with study of culture and civilization. Languages will vary but may include Italian, Hindi, or Russian. May be repeated for credit as language varies (6 hours maximum).","3-0","R"
"LANG","2312","Intermediate Language Instruction II","3","This course is a continuation of LANG 2311 Intermediate Language Instruction I. It will include review and application of skills in listening comprehension, speaking, reading, and writing. The course emphasizes conversation, vocabulary acquisition, reading, and composition. A major course component will be an emphasis on culture. Languages will vary but may include Italian, Hindi, or Russian. May be repeated for credit as language varies (6 hours maximum).","3-0","R"
"LANG","2342","Topics in Language","3","Subject matter will vary from semester to semester. May be repeated for credit as topics vary (6 hours maximum).","3-0","R"
"LANG","3342","Advanced Language Instruction","3","This course is a continuation of instruction in foreign languages not taught on a regular basis. Languages will vary. May be repeated for credit as topics vary (6 hours maximum).","3-0","R"
"LANG","3348","Topics in Language","3","Subject matter will vary from semester to semester. May be repeated for credit as topics vary (6 hours maximum).","3-0","R"
"LANG","4348","Advanced Topics in Language","3","Subject matter will vary from semester to semester. May be repeated for credit as topics vary (6 hours maximum).","3-0","R"
"LATS","6300","Introduction to Latin American Studies","3","An interdisciplinary introduction to the theories, methodologies, topics, and themes relevant to the study of Latin America. Required of all students in the M.A. program in Latin American Studies.","3-0","Y"
"LATS","6390","Internship in Latin American Studies","3","Students will complete an internship established in partnership with UT Dallas and businesses and/or not-for-profit agencies in the Dallas-Fort Worth area. (May be repeated but only 6 credit hours will be counted toward the M.A.)","3-0","R"
"LATS","6399","Capstone Project in Latin American Studies","3","Students produce a capstone project on a topic of their choice in Latin American Studies in the form of either a research thesis or final project. (May be repeated but only 6 credit hours will be counted toward the M.A.)","3-0","R"
"LIT","2331","Masterpieces of World Literature","3","A study of selected themes in world literature. This course will serve as a prerequisite for all upper-division literature courses.","3-0","Y"
"LIT","2332","Studies in Mythology","3","An introduction to mythology, with emphasis on the adaptability of mythic themes and characters as reflected in literature from antiquity through the contemporary period.","3-0","T"
