"Prefix","Number","Title","Hours","Description","Unk","Taught"
"HIST","3370","The American Experience in Vietnam","3","An analysis of the political, diplomatic, economic, and cultural impact the Vietnam War had on American society. Students will analyze monographs, memoirs, novels, documentaries, and feature films. Prerequisite: HIST 1301, HIST 1302, HIST 2301, HIST 2330, HIST 2331, or equivalent.","3-0","T"
"HIST","3371","Twentieth-Century American Culture and Society","3","An exploration of the interplay between social change and cultural developments during the 20th century. Topics include urban life, mass marketing and media, gender roles, ethnic identity, and the relation between ""high"" and ""low"" culture. Prerequisite: HIST 1301, HIST 1302, HIST 2301, HIST 2330, HIST 2331, or equivalent.","3-0","R"
"HIST","3374","American Technological Development","3","A survey of the role played by technology in shaping American culture from colonial times to the present. Prerequisite: HIST 1301, HIST 1302, HIST 2301, HIST 2330, HIST 2331, or equivalent.","3-0","T"
"HIST","3376","American Intellectual History, Colonial to the Civil War","3","A survey of some of the principal developments in American thought from the colonial era to the civil war. Prerequisite: HIST 1301, HIST 1302, HIST 2301, HIST 2330, HIST 2331, or equivalent.","3-0","T"
"HIST","3377","American Intellectual History, Civil War to the Present","3","An exploration of the origins of contemporary American intellectual life through the study of changing ideas about society, politics, science, religion, and art from the civil war to the present. Prerequisite: HIST 1301, HIST 1302, HIST 2301, HIST 2330, HIST 2331, or equivalent.","3-0","T"
"HIST","3379","United States Relations with Latin America","3","An analysis of the United States' political, economic, military, and cultural relations with Latin America, with emphasis on the period since the 1890s. Prerequisite: HIST 1301, HIST 1302, HIST 2301, HIST 2330, HIST 2331, or equivalent.","3-0","T"
"HIST","3380","The Nuclear Age in America","3","An examination of the historical roots of the modern nuclear age. Topics will include the development of the atomic bomb and the role of nuclear weapons in postwar diplomacy. Prerequisite: HIST 1301, HIST 1302, HIST 2301, HIST 2330, HIST 2331, or equivalent.","3-0","T"
"HIST","3382","The United States Since 1945","3","An analysis of the key political, diplomatic, socioeconomic, technological, and cultural changes that have shaped contemporary U.S. society. Prerequisite: HIST 1301, HIST 1302, HIST 2301, HIST 2330, HIST 2331, or equivalent.","3-0","T"
"HIST","3384","U.S. Women from Settlement to Present","3","A survey of the changing social, political, and economic roles of American women. Particular attention will be paid to the diversity of women's roles, focusing on how women of different races, classes, and sexualities interpreted their ""American experience."" Prerequisite: HIST 1301, HIST 1302, HIST 2301, HIST 2330, HIST 2331, or equivalent.","3-0","T"
"HIST","3385","Early African-American History","3","A study of themes and issues in the history of African-Americans in the United States. These may include slavery, Blacks in the ante-bellum United States, free Blacks in the ante-bellum era, and Reconstruction. Emphasis will be on African-American perspectives. Prerequisite: HIST 1301, HIST 1302, HIST 2301, HIST 2330, HIST 2331, or equivalent.","3-0","R"
"HIST","3386","World History to 1500","3"," A survey of social, economic, political, and cultural life in major world civilizations from their origins through 1500.  Prerequisite: HIST 1301, HIST 2301, HIST 2330, HIST 2331 or equivalent.","3-0","R"
"HIST","3387","World History from 1500","3","A survey of social, economic, political, and cultural life in major world civilizations from 1500 through the present.  Prerequisite: HIST 1301, HIST 2301, HIST 2330, HIST 2331, or equivalent. ","3-0","R"
"HIST","3389","History of Science in the U.S.","3","Surveys the development of the mathematical and natural sciences in American culture. Subject matter will vary from semester to semester, but topics may include astronomy, physics, chemistry, biology, medicine, natural history, geology, evolution, and genetics. Course content will not overlap with HIST 3337. No technical background required. May be repeated for credit as topics vary (9 hours maximum). Prerequisite: HIST 1301, HIST 1302, HIST 2301, HIST 2330, HIST 2331, or equivalent.","3-0","R"
"HIST","3390","Twentieth-Century African-American History","3","A study of themes in the history of African-Americans in the twentieth century. The course will focus on the civil rights movement, though other themes will also be explored. Emphasis will be on African-American perspectives and the ongoing struggle for self-determination by African-Americans. Prerequisite: HIST 1301, HIST 1302, HIST 2301, HIST 2330, HIST 2331, or equivalent.","3-0","R"
"HIST","3394","Native American History from the Pre-Columbian Period through 1795","3","Examines the arrival of Native Americans in the New World and the cultures that emerged and declined there in the pre-Columbian period. Will also discuss the intellectual framework within which Europeans envisioned Native Americans. Prerequisite: HIST 1301, HIST 1302, HIST 2301, HIST 2330, HIST 2331, or equivalent.","3-0","T"
"HIST","3395","Native American History in the Nineteenth Century","3","Examines the interaction of Native Americans and ""whites"" during the nineteenth century, primarily in the region west of the Appalachians to the Pacific. Will focus on the cultures of the desert Southwest in the Spanish colonial period. Prerequisite: HIST 1301, HIST 1302, HIST 2301, HIST 2330, HIST 2331, or equivalent.","3-0","T"
"HIST","3396","Native Americans in the Twentieth Century","3","Discusses the allotment or destruction of the reservation system in much of the United States at the turn of the century and will also focus on government attempts to force Native Americans to discard their indigenous identity. Prerequisite: HIST 1301, HIST 1302, HIST 2301, HIST 2330, HIST 2331, or equivalent.","3-0","T"
"HIST","3397","Modern Mexico","3","An overview of the political, economic, social, and cultural history of Mexico from the era of Independence (roughly 1810 to present).  Prerequisite: HIST 1301, HIST 1302, HIST 2301, HIST 2330, HIST 2331, or equivalent.","3-0","T"
"HIST","3398","Colonial Latin American History","3","A survey of Latin America from its pre-Columbian past to independence (roughly 1821), the course will emphasize the process of merging pre-Columbian and European cultures throughout the colonial period. Prerequisite: HIST 1301, HIST 1302, HIST 2301, HIST 2330, HIST 2331, or equivalent.","3-0","T"
"HIST","3399","Modern Latin American History","3","A survey of Latin America from independence (roughly 1821) to the present, the course will emphasize the intersection of far-reaching political trends with local cultures in the nineteenth and twentieth centuries. Prerequisite: HIST 1301, HIST 1302, HIST 2301, HIST 2330, HIST 2331, or equivalent.","3-0","T"
"HIST","4330","The Holocaust","3","Study of the political, social, historical, and cultural events leading to and constituting the Holocaust.  Prerequisite: HIST 1301, HIST 1302, HIST 2301, HIST 2330, HIST 2331, or equivalent.","3-0","T"
"HIST","4331","Holocaust and Representation","3","Study of the depiction and representation of the Holocaust in art, literature, poetry, and film.","3-0","T"
"HIST","4344","Topics in European History","3","Subject matter will vary from semester to semester. May be repeated for credit (9 hours maximum). Prerequisite: HIST 1301, HIST 1302, HIST 2301, HIST 2330, HIST 2331, or equivalent.","3-0","R"
"HIST","4345","Origins of the Jim Crow South","3","An examination of the origins of segregation and disfranchisement in the American South following Reconstruction through World War II. Attention will be paid to both the legal and extralegal edifices upholding white supremacy and the evolution of a racist consumer culture. The course will also explore African-American resistance to Jim Crow. Prerequisite: HIST 1301, HIST 1302, HIST 2301, HIST 2330, HIST 2331, or equivalent.","3-0","R"
"HIST","4346","American Culture 1877 - 1919","3","A survey of the Gilded Age or Progressive Era, 1877 - 1919. Themes will include expansion of industrial capitalism, the influx of ""new immigrants"" and patterns of ""Americanization,"" middle-class social reform, emergence of the U.S. as an imperial power, explosion of nativist and racist sentiments, and the political mobilization of labor. Prerequisite: HIST 1301, HIST 1302, HIST 2301, HIST 2330, HIST 2331, or equivalent.","3-0","R"
"HIST","4357","Topics in African and African-American History","3","Subject matter will vary from semester to semester. May be repeated for credit as topics vary (9 hours maximum). Prerequisite: HIST 1301, HIST 1302, HIST 2301, HIST 2330, HIST 2331, or equivalent.","3-0","R"
"HIST","4358","Topics in Asian History","3","Subject matter will vary from semester to semester. May be repeated for credit as topics vary (9 hours maximum). Prerequisite: HIST 1301, HIST 1302, HIST 2301, HIST 2330, HIST 2331, or equivalent.","3-0","R"
"HIST","4359","Topics in Latin American History","3","Subject matter will vary from semester to semester. May be repeated for credit as topics vary (9 hours maximum). Prerequisite: HIST 1301, HIST 1302, HIST 2301, HIST 2330, HIST 2331, or equivalent.","3-0","R"
"HIST","4360","Topics in American Women's History","3","Subject matter will vary from semester to semester and may include Women and the American Frontier, Popular Culture and Mass Media, and American Religious Societies. May be repeated for credit as topics vary (9 hours maximum). Prerequisite: HIST 1301, HIST 1302, HIST 2301, HIST 2330, HIST 2331, or equivalent.","3-0","T"
"HIST","4376","Topics in History","3","Subject matter will vary from semester to semester. May be repeated for credit as topics vary (9 hours maximum). Prerequisite: HIST 1301, HIST 1302, HIST 2301, HIST 2330, HIST 2331, or equivalent.","3-0","R"
"HIST","4377","Topics in Early American History","3","Focuses on the formative era of the American nation. Social, cultural, political, and economic issues are examined within the context of important transformations over time. Topics will vary and may include British Colonial America (1609-1763), The Era of the American Revolution, and The Early American Republic (1785-1828). May be repeated for credit as topics vary (9 hours maximum). Prerequisite: HIST 1301, HIST 1302, HIST 2301, HIST 2330, HIST 2331, or equivalent.","3-0","T"
"HIST","4378","Topics in American History","3","Subject matter will vary from semester to semester. May be repeated for credit as topics vary (9 hours maximum). Prerequisite: HIST 1301, HIST 1302, HIST 2301, HIST 2330, HIST 2331, or equivalent.","3-0","R"
"HIST","4380","Topics in Intellectual History","3","Subject matter will vary from semester to semester. May be repeated for credit as topics vary (6 hours maximum). Prerequisite: HIST 1301, HIST 1302, HIST 2301, HIST 2330, HIST 2331, or equivalent.","3-0","R"
"HIST","4399","Senior Honors in Historical Studies","3","Intended for students conducting independent research for honors theses or projects. Prerequisite: Signature of the instructor on proposed project outline required.","3-0","R"
"HIST","4V71","Independent Study in Historical Studies","1-3","Independent study under a faculty member's direction. May be repeated for credit (9 hours maximum). Permission of the instructor required.","[1-3]-0","R"
"HIST","6301","Historiography","3","Graduate-level introduction to the practice and forms of written history. Required of all students in the M.A. program in History, this course examines the ways in which historians have conceived of their craft, the centrality of interpretation to the historical process, and the use of a variety of methods and theories in the study of the past.","3-0","Y"
"HIST","6310","Early American History","3","The study of specific themes and/or periods in American history through the American Revolution. Topics may vary. (May be repeated for credit to a maximum of 9 credit hours.)","3-0","T"
"HIST","6320","America in the Nineteenth Century","3","The study of specific themes and/or periods in American history in the nineteenth century. Topics may include the Civil War and Reconstruction. Topics may vary. (May be repeated for credit to a maximum of 9 credit hours.)","3-0","T"
"HIST","6324","Gilded Age & Progressive Era","3","The study of social, political, and economic life in the period between 1877 and 1919. Special attention to the relationship between government and society.","3-0","T"
"HIST","6325","America in the Twentieth Century","3","The study of specific themes and/or periods of American history in the twentieth century. Topics may include World War I, World War II, and the Civil Rights Era. Topics may vary. (May be repeated for credit to a maximum of 9 credit hours.)","3-0","T"
"HIST","6326","U.S. Foreign Relations","3","The study of U.S. diplomatic relations with Asia, Africa, Europe, Latin America, the Middle East, and Soviet Russia in the twentieth and twenty-first centuries.","3-0","T"
"HIST","6327","U.S. Since 1945","3","The study of the political, economic, social, and cultural development of the United States since the end of World War II.","3-0","T"
"HIST","6330","Regional and Area History in the United States","3","The study of themes related to the history of specific regions of the United States, for example the South, the Southwest, and Texas. Topics may vary. (May be repeated for credit to a maximum of 6 credit hours.)","3-0","T"
"HIST","6332","Slavery in America","3","The study of the origins, evolution, growth and destruction of racial slavery in America from 1619-1865.","3-0","T"
"HIST","6333","Rise of the Jim Crow South","3","The study of the origins of segregation and disfranchisement in the New South. Explores historiographical debates about the nature and meaning of Jim Crow.","3-0","T"
"HIST","6335","U.S. Women","3","The study of recent historiography, current methods, and major themes in U.S. women's and gender history.","3-0","T"
"HIST","6340","European and World History","3","The study of specific themes and/or periods in the history of Europe and the world. Topics may vary. (May be repeated for credit to a maximum of 9 credit hours.)","3-0","T"
"HIST","6350","Asian History","3","The study of specific themes and/or periods in the history of Asia. (May be repeated for credit as topics vary to a maximum of 9 credit hours.)","3-0","T"
"HIST","6360","Latin American History","3","The study of specific themes and/or periods in the history of Latin America. (May be repeated for credit as topics vary to a maximum of 9 credit hours.)","3-0","T"
"HIST","6365","Mexican History","3","The study of specific themes and/or periods in the history of Mexico. (May be repeated for credit as topics vary to a maximum of 9 credit hours.)","3-0","T"
"HIST","6370","Middle Eastern History","3","The study of specific themes and/or periods in the history of the Middle East. (May be repeated for credit as topics vary to a maximum of 9 credit hours.)","3-0","T"
"HIST","6390","Topics in History","3","The study of specific themes and/or periods in history. (May be repeated for credit as topic vary to a maximum of 9 hours.)","3-0","R"
"HIST","6395","Special Topics in History","3","If taken as an independent studies course may count toward minimum course requirements for the M.A. degree.  (May be repeated for credit to a maximum of 9 hours.)","3-0","R"
"HIST","6397","Independent Readings in History","3"," (May be repeated for credit.)","3-0","R"
"HIST","6398","Independent Research in History","3"," (May be repeated for credit.)","3-0","R"
"HIST","6399","Master's Thesis","3","(May be repeated for credit but only 6 hours will be counted toward M.A.)","3-0","R"
"HUAS","6303","Performance Literature, Theory, and Criticism","3","Examination of a wide range of performance and theatrical traditions and texts. Using various critical and theoretical perspectives, the focus will be on the interplay between textual analysis, theoretical and critical frames, and performance. (May be repeated for credit as topics vary to a maximum of 9 credit hours.)","3-0","T"
"HUAS","6305","Criticism, Interpretation, and Performance","3","An investigation of the interrelationship among the activities of criticizing, interpreting, and performing artistic texts. Examples may be drawn from literature, theater, performance art, web and inter-media applications, film/video, music, and the visual arts. The course will include an exploration of the effects of various cultural and theoretical perspectives on our response to specific works.","3-0","T"
"HUAS","6310","Introduction to Film Studies","3","Study of the history and formal and stylistic elements of cinema as a medium of expression, as an industry, and as an art form; and an introduction to the tenets and theoretical basis of the academic discipline known as film studies.","3-0","T"
"HUAS","6312","Art and Society","3","Study of the many forms of interaction between the arts and the society in which they exist. Topics may include the role of the artist in society, the representation of social and religious values in art, or the influence of art and the artist upon society. (May be repeated for credit as topics vary to a maximum of 9 credit hours.)","3-0","T"
"HUAS","6313","The Business of the Arts","3","Exploration of effective means to find, create, and manage markets and audiences for works of art. Topics may include digital media, visual or performing arts, museum studies, and arts management. (May be repeated for credit as topics vary to a maximum of 6 credit hours.)","3-0","T"
"HUAS","6315","The Arts in Historical Contexts","3","Studies in one or more arts of various places and historical periods. Topics will vary, but may focus on a particular movement (e.g., Surrealism), a specific era (e.g., the Renaissance), or a place (e.g., Paris in the early twentieth century). (May be repeated for credit as topics vary to a maximum of 9 credit hours.)","3-0","Y"
"HUAS","6317","Art and Authorship","3","Study of the role of the maker in the creation of art. Topics vary but may include visual artists, filmmakers, composers, writers, or other artists. (May be repeated for credit as topics vary to a maximum of 9 credit hours.)","3-0","T"
"HUAS","6318","The Arts and Their Institutions","3","Studies of the institutions that shape and present the visual and performing arts by providing their physical, administrative, and financial ""frames"": art museums, theaters, symphony associations, performance consortiums, or private foundations. The course will focus selectively on these institutions, grouping them for study in various ways depending on the interests and expertise of the instructor. (May be repeated for credit as topics vary to a maximum of 9 credit hours.)","3-0","T"
"HUAS","6320","Studies in Experimental Traditions","3","Studies in the works of artists whose experimentation with forms of expression breaks new ground in the arts and demands changes in the aesthetic perception of the public. The course will focus on such experimental movements as modernism, postmodernism and various avant-gardes that form the new tradition of the contemporary arts. (May be repeated for credit as topics vary to a maximum of 9 credit hours.)","3-0","T"
"HUAS","6324","Spaces of Display and Performance","3","Usually art works and performances are encountered in specific ritualized spaces designed for them and exerting strong influence on their character. The course will address such spaces critically from the point of view of architecture, theories of display, and concepts of ritual spectatorship.","3-0","T"
"HUAS","6330","Studies in the Visual Arts","3","Explorations in various forms of the visual arts. The course may focus on a specific form (e.g., painting, sculpture, film, photography) or interrelations among visual forms. Emphasis will be on the understanding of the creative process underlying the finished work. (May be repeated for credit as topics vary to a maximum of 9 credit hours.)","3-0","T"
"HUAS","6331","Studies in Music","3","Studies in forms of musical expression. Topics will vary, but the course will emphasize the nature, development, and artistic possibilities of various forms of music. Courses may relate music to developments in other arts. (May be repeated for credit as topics vary to a maximum of 9 credit hours.)","3-0","T"
"HUAS","6333","Advanced Orchestra/Chamber Music Ensemble","3","Workshop in which instrumentalists, singers, dancers, actors, composers, lyricists, visual artists and/or video/performance artists create and perform music for small and larger ensembles, plus multi-media and theater works. (May be repeated for credit to a maximum of 9 credit hours.) Permission of instructor required.","3-0","T"
"HUAS","6334","Iberian Culture and Music","3","Study of the transfer of music and culture between Spain, Portugal, and the countries of the Americas which had close connections to the Iberian countries via language, culture, and commerce.","3-0","T"
"HUAS","6336","Photography Studio/Seminar","3","Workshop-based course designed to foster reflection on the relationship between human perception and the photographic mediation of reality. The course may emphasis photographic processes or conceptual frameworks.  (May be repeated for credit to a maximum of 9 credit hours.)","3-0","T"
"HUAS","6337","Digital Photography","3","Workshop in which students explore digital photography within the context of contemporary art, emphasizing the relationship between digital imaging processes and color photographic techniques. (May be repeated for credit to a maximum of 6 credit hours.)","3-0","T"
"HUAS","6339","Painting/Digital Imaging/Video","3","Workshop in which students will pursue creative work in a medium of their preference or expertise (can include painting, drawing, digital imaging, video or hybrid forms). (May be repeated for credit to a maximum of 9 credit hours.)","3-0","T"
"HUAS","6340","Studies in Theater and Dance","3","An investigation of theater, performance art, inter-media, and/or dance as forms of art. The course will relate to and incorporate trends in other arts and contemporary intellectual and cultural movements, theories and critical issues. (May be repeated for credit as topics vary to a maximum of 9 credit hours.)","3-0","T"
"HUAS","6345","Shakespeare in Performance","3","Studies of Shakespeare's plays, examining varied artistic and scholarly interpretations in film and performance. The course will blend lectures, discussions, and practical skill-based exercises and may include scholarly and/or creative projects. Meant for aspiring writers, actors, directors, and teachers, with or without experience in performing. Topics may vary. (May be repeated for credit to a maximum of 6 semester hours.)","3-0","T"
"HUAS","6347","Solo Performance","3","Workshop in which students explore aspects of devising, writing and performing solos, with an emphasis on developing work in multiple genres, media, and formats. (May be repeated for credit to a maximum of 9 credit hours.)","3-0","T"
"HUAS","6348","Performance Installation","3","An exploration of the theory, history, and practice of employing installation and performance art with technology as a means of extending personal artistic practice. Emphasis will be on practical experience in the conceptualization and production of collaborative, experimental, trans-disciplinary artistic expression. (May be repeated for credit to a maximum of 9 credit hours.)","3-0","T"
"HUAS","6350","Creating Poetry","3","An investigation in a workshop environment of the aesthetics of the art and creation of poetry, focusing on the creative techniques and processes involved in producing poems and song lyrics in a variety of formalist, free verse, and experimental forms that combine verbal, written art with the visual and performing arts. Topics may vary. (May be repeated for credit to a maximum of 9 credit hours.)","3-0","T"
"HUAS","6351","Creating Novels","3","An investigation in a workshop environment of the aesthetics of the art and creation of the novel, focusing on the creative techniques and processes involved in producing novels in a variety of lyrical, experimental, and traditional forms that combine verbal, written art with the visual and performing arts. Topics may vary. (May be repeated for credit to a maximum of 9 credit hours.)","3-0","T"
"HUAS","6352","Creating Television and Movie Scripts","3","An investigation in a workshop environment of the aesthetics of art and creation of movie, multimedia, video, and television scripts, focusing on the creative techniques and processes involved in producing scripts in a variety of experimental and traditional forms that combine verbal, written art with acting, filmmaking, and production. Topics may vary. (May be repeated for credit to a maximum of 9 credit hours.)","3-0","T"
"HUAS","6353","Creating Plays and Musicals","3","An investigation in a workshop environment of the aesthetics of art and creation of drama, focusing on the creative techniques and processes involved in producing plays and musicals in a variety of experimental and traditional forms that combine verbal, written art with the musical and dramatic arts. Topics may vary. (May be repeated for credit to a maximum of 9 credit hours.)","3-0","T"
